EVENT_ID,CZ_NAME_STR,BEGIN_LOCATION,BEGIN_DATE,BEGIN_TIME,EVENT_TYPE,MAGNITUDE,TOR_F_SCALE,DEATHS_DIRECT,INJURIES_DIRECT,DAMAGE_PROPERTY_NUM,DAMAGE_CROPS_NUM,STATE_ABBR,CZ_TIMEZONE,MAGNITUDE_TYPE,EPISODE_ID,CZ_TYPE,CZ_FIPS,WFO,INJURIES_INDIRECT,DEATHS_INDIRECT,SOURCE,FLOOD_CAUSE,TOR_LENGTH,TOR_WIDTH,BEGIN_RANGE,BEGIN_AZIMUTH,END_RANGE,END_AZIMUTH,END_LOCATION,END_DATE,END_TIME,BEGIN_LAT,BEGIN_LON,END_LAT,END_LON,EVENT_NARRATIVE,EPISODE_NARRATIVE,ABSOLUTE_ROWNUMBER
944504,EAST FELICIANA PAR.,CLINTON,02/11/2021,800,Flash Flood, , ,0,0,0,0,LA,CST-6, ,156401,C,37,LIX,0,0,Public,Heavy Rain, , ,1,E,0,ENE,CLINTON,02/11/2021,1000,30.867,-91.0096,30.8715,-91.0255,"Several streets in Clinton were flooded and impassable due to 6.47 inches of rain.","A cold front slowly tracked across the region on the morning of the 11th. The slow movement of the cold front in combination with abundant moisture in place allowed for training of heavy rainfall. Over 6 inches of rain fell in a short time period which resulted in flash flooding.",1
943682,CONCORDIA PAR.,VIDALIA,02/17/2021,1445,Flash Flood, , ,0,0,10000,0,LA,CST-6, ,156323,C,29,JAN,0,0,Emergency Manager,Heavy Rain, , ,1,WNW,2,NNE,VIDALIA,02/17/2021,1645,31.5519,-91.4408,31.5698,-91.415,"Several streets in Vidalia were flooded over by runoff from heavy rain and ice jammed drainages across town.","As an arctic air mass continued to build southward across the South on February 17th, another wave of precipitation overspread this cold air mass across northeast Louisiana. The main impacts across this portion of the state were from freezing rain and resulting heavy icing, but some significant accumulations of sleet and snow also occurred. Freezing rain continued through the evening hours. Ice accumulated quickly in many locations and downed numerous trees, large limbs, and power lines. Several trees and limbs fell onto power lines, resulting in more widespread power outages as well. Significant impacts to travel and electrical infrastructure occurred in the hardest hit areas. In the Vidalia area, heavy rain flooded several roads due to ice-blocked drainages.",2
948433,CALCASIEU PAR.,LAKE CHARLES,03/23/2021,700,Flash Flood, , ,0,0,10000,0,LA,CST-6, ,156912,C,19,LCH,0,0,Public,Heavy Rain, , ,0,NW,1,W,MALLARD,03/23/2021,800,30.2327,-93.2044,30.2275,-93.1723,"Four to six inches of rain across sections of Lake Charles resulting in flooding of several streets. Several cars were reported flooded along with some streets being bumper deep to SUVs.","A cold front slowly moved through the region during the morning of the 23rd. Heavy resulted in flooding at a few locations. A tornado also occurred.",3
949948,ORLEANS PAR.,VIEUX CARRE,03/23/2021,1300,Flash Flood, , ,0,0,0,0,LA,CST-6, ,157150,C,71,LIX,0,0,Emergency Manager,Heavy Rain, , ,1,N,1,NE,VIEUX CARRE,03/23/2021,1300,29.9841,-90.0781,29.9781,-90.0673,"Numerous streets flooded and some impassible. Flooding reported in the following areas of New Orleans: dauphine/iberville, chippewa/third, tchoupitoulas/louisiana, charters/homer, paris/gentilly, haynes/downman, oak/carrollton, poydras/camp, carrollton/maple, carrollton/hampson.","During the daytime hours on March 23rd through March 24th, a deep west coast trough helped to deliver progressive yet strong southwesterly upper-level to mid-level moist flow across the northern Gulf coast. At the surface, a complex of strong to severe thunderstorms approached the area from the west, quickly advancing east causing widespread severe thunderstorms and areas of flash flooding. Another round of thunderstorms developed during the day on March 24th.",4
949949,TERREBONNE PAR.,HOUMA,03/23/2021,1931,Flash Flood, , ,0,0,0,0,LA,CST-6, ,157150,C,109,LIX,0,0,Emergency Manager,Heavy Rain, , ,2,SSE,1,NW,PRESQUE ISLE,03/23/2021,1931,29.58,-90.71,29.5788,-90.657,"Rainfall totals of 6-7 estimated. Multiple structures with water in the buildings and multiple roads with water across them at this time.","During the daytime hours on March 23rd through March 24th, a deep west coast trough helped to deliver progressive yet strong southwesterly upper-level to mid-level moist flow across the northern Gulf coast. At the surface, a complex of strong to severe thunderstorms approached the area from the west, quickly advancing east causing widespread severe thunderstorms and areas of flash flooding. Another round of thunderstorms developed during the day on March 24th.",5
953892,JEFFERSON PAR.,(MSY)MOISANT FLD NEW,04/08/2021,312,Flash Flood, , ,0,0,0,0,LA,CST-6, ,157810,C,51,LIX,0,0,Emergency Manager,Heavy Rain, , ,2,N,2,N,(MSY)MOISANT FLD NEW,04/08/2021,312,30.0343,-90.2557,30.0312,-90.2557,"Kenner emergency management relayed a report from police that the intersection of Chateau and Vintage was impassable.","A strong cold front swept through the region on the 8th of April. Ample moisture in place combined with strong lift along the frontal boundary set the stage for several severe storms producing damaging winds, some flash flooding and a brief tornado.",6
953891,JEFFERSON PAR.,KENNER,04/08/2021,332,Flash Flood, , ,0,0,0,0,LA,CST-6, ,157810,C,51,LIX,0,0,Fire Department/Rescue,Heavy Rain, , ,1,S,1,W,BRIDGE CITY,04/08/2021,332,29.9718,-90.2304,29.9682,-90.2327,"Southeast Search and Rescue reported water over 2 feet deep on Sofia Street in River Ridge.","A strong cold front swept through the region on the 8th of April. Ample moisture in place combined with strong lift along the frontal boundary set the stage for several severe storms producing damaging winds, some flash flooding and a brief tornado.",7
954087,ST. CHARLES PAR.,BOUTTE,04/13/2021,1310,Flash Flood, , ,0,0,0,0,LA,CST-6, ,157843,C,89,LIX,0,0,Emergency Manager,Heavy Rain, , ,1,WNW,0,WNW,BOUTTE,04/13/2021,1310,29.9041,-90.3954,29.9022,-90.3864,"Alexander Street was impassable due to heavy rainfall.","A wake low developed on the backside of a cluster of showers and thunderstorms racing south across southeast Louisiana. This drastically enhanced downdraft winds, producing long duration winds around tropical storm strength across the area with peak gusts as strong as a weak hurricane.",8
954088,ST. CHARLES PAR.,DESTREHAN,04/13/2021,1310,Flash Flood, , ,0,0,0,0,LA,CST-6, ,157843,C,89,LIX,0,0,Emergency Manager,Heavy Rain, , ,0,N,0,SSW,DESTREHAN,04/13/2021,1310,29.97,-90.38,29.965,-90.3821,"Ormond Village Drive in Destrahan was impassable due to heavy rainfall.","A wake low developed on the backside of a cluster of showers and thunderstorms racing south across southeast Louisiana. This drastically enhanced downdraft winds, producing long duration winds around tropical storm strength across the area with peak gusts as strong as a weak hurricane.",9
954089,ST. CHARLES PAR.,LULING,04/13/2021,1315,Flash Flood, , ,0,0,0,0,LA,CST-6, ,157843,C,89,LIX,0,0,Public,Heavy Rain, , ,1,W,2,ESE,LULING ARPT,04/13/2021,1315,29.93,-90.37,29.9245,-90.3752,"Milling Avenue between Post Drive and Hall Drive in Lulling was impassable due to heavy rainfall.","A wake low developed on the backside of a cluster of showers and thunderstorms racing south across southeast Louisiana. This drastically enhanced downdraft winds, producing long duration winds around tropical storm strength across the area with peak gusts as strong as a weak hurricane.",10
955752,IBERIA PAR.,INDEPENDENT,04/13/2021,1414,Flash Flood, , ,0,0,0,0,LA,CST-6, ,158111,C,45,LCH,0,0,Law Enforcement,Heavy Rain, , ,1,W,2,SSW,NEW IBERIA ARPT,04/13/2021,1514,30.03,-91.86,30.0066,-91.8893,"Numerous roads were underwater and impassable or closed after several inches of rain.","A cut off upper low slowly worked across the deep south during the middle of April. This produced multiple days of stormy weather.",11
954323,ST. TAMMANY PAR.,MANDEVILLE,04/15/2021,559,Flash Flood, , ,0,0,50000,0,LA,CST-6, ,157879,C,103,LIX,0,0,Public,Heavy Rain, , ,1,E,1,E,MANDEVILLE,04/15/2021,559,30.3633,-90.0707,30.3627,-90.0713,"Heavy rainfall lead to flash flooding and a home taking on water in Old Mandeville.","A line of thunderstorms moving along a stalled frontal boundary draped across the coastal waters produced localized flash flooding and hail.",12
960510,ST. TAMMANY PAR.,CHINCHUBA,05/05/2021,730,Flash Flood, , ,0,0,0,0,LA,CST-6, ,158886,C,103,LIX,0,0,Broadcast Media,Heavy Rain, , ,2,ESE,3,ESE,CHINCHUBA,05/05/2021,730,30.3844,-90.0496,30.3844,-90.0322,"Report of water covered roads at Viola Street in Mandeville due to flash flooding from heavy rainfall.","In the early morning hours on May 5th 2021, a cold front and associated band of showers and storms pushed across portions of southeastern Louisiana. This cluster of storms would eventually slow down as the cold front stalled across the northern Gulf leading to flash flooding across a few locations of southeastern Louisiana.",13
960511,ORLEANS PAR.,VIEUX CARRE,05/05/2021,730,Flash Flood, , ,0,0,0,0,LA,CST-6, ,158886,C,71,LIX,0,0,Public,Heavy Rain, , ,3,NW,4,NNW,VIEUX CARRE,05/05/2021,730,29.9964,-90.1157,30.0198,-90.1139,"Report of street flooding in the Lakeview area of New Orleans due to heavy rain.","In the early morning hours on May 5th 2021, a cold front and associated band of showers and storms pushed across portions of southeastern Louisiana. This cluster of storms would eventually slow down as the cold front stalled across the northern Gulf leading to flash flooding across a few locations of southeastern Louisiana.",14
948465,SABINE PAR.,ZWOLLE AMMONS ARPT,05/09/2021,2100,Flash Flood, , ,0,0,0,0,LA,CST-6, ,156928,C,85,SHV,0,0,Law Enforcement,Heavy Rain, , ,4,SSE,9,NE,MT CARMEL,05/10/2021,400,31.4785,-93.6792,31.5538,-93.2691,"Several roads across the southern sections of Sabine Parish were flooded and closed.","Warm, humid, and unstable conditions were in place across the Four State Region on May 9th, ahead of a cold front and attendant shortwave trough that traversed the Southern Plains during the afternoon. Large scale forcing ahead of the trough increased during the afternoon, with scattered showers and thunderstorms developing near and ahead of the front across Southwest Arkansas, North Louisiana, and East Texas. Moderate instability and adequate wind shear contributed to the development of strong to severe thunderstorms across the region, which produced damaging winds and large hail. One specific cluster of strong to severe thunderstorms affected portions of Deep East Texas and West-central Louisiana, and continued to redevelop over the same areas, producing a wide swath of heavy rainfall with rainfall amounts of three to in excess of seven inches falling over Southern Cherokee, Nacogdoches, Angelina, San Augustine, and Sabine Counties, as well as Central and Southern Sabine Parish. This resulted in widespread flash flooding over these areas, which persisted into the early morning hours of the 10th before the storms shifted south of the area by daybreak.",15
960506,ORLEANS PAR.,NEW ORLEANS,05/10/2021,220,Flash Flood, , ,0,0,0,0,LA,CST-6, ,158883,C,71,LIX,0,0,County Official,Heavy Rain, , ,3,NNW,3,NW,VIEUX CARRE,05/10/2021,220,29.9812,-90.1221,30.0023,-90.1214,"Several underpasses closed due to flooding in the city of New Orleans after 1.5 inches of rain in 30 minutes.","In the early morning hours on May 10th, 2021, slow moving thunderstorms from a stalled frontal boundary delivered flash flooding to portions of the southshore of southeastern Louisiana.",16
960507,JEFFERSON PAR.,METAIRIE,05/10/2021,254,Flash Flood, , ,0,0,0,0,LA,CST-6, ,158883,C,51,LIX,0,0,Emergency Manager,Heavy Rain, , ,3,NNE,3,NNW,METAIRIE,05/10/2021,254,30.0218,-90.1225,30.0224,-90.1698,"Numerous streets flooded in the Metairie area, with several vehicles stalled.","In the early morning hours on May 10th, 2021, slow moving thunderstorms from a stalled frontal boundary delivered flash flooding to portions of the southshore of southeastern Louisiana.",17
960185,LAFAYETTE PAR.,BILLEAUD,05/11/2021,2330,Flash Flood, , ,0,0,0,0,LA,CST-6, ,158822,C,55,LCH,0,0,Public,Heavy Rain, , ,3,SSW,4,ESE,YOUNGSVILLE,05/11/2021,2330,30.1153,-91.9428,30.0643,-91.938,"Pictures and video on social media showed water over roadways in Youngsville.","A cold front moved into the region during stalled during the morning of the 11th. Diurnal heating combined with high moisture and a disturbance aloft allowed scattered showers and thunderstorms to develop with some becoming severe.",18
960707,CALCASIEU PAR.,DE QUINCY,05/17/2021,905,Flash Flood, , ,0,0,0,0,LA,CST-6, ,158930,C,19,LCH,0,0,Emergency Manager,Heavy Rain, , ,1,W,2,SSW,DE QUINCY,05/17/2021,1005,30.45,-93.44,30.4274,-93.445,"Multiple roads were flooded and impassible in Dequincy.","A cold front moved in and stalled while multiple upper level disturbances moved through. High moisture levels and ample lift provided a few days of flooding and severe thunderstorms.",19
960716,CALCASIEU PAR.,LAKE CHARLES LAKE,05/17/2021,945,Flash Flood, , ,1,0,500000000,0,LA,CST-6, ,158930,C,19,LCH,0,0,NWS Employee,Heavy Rain, , ,1,SE,1,N,ARARET,05/17/2021,1445,30.2248,-93.2212,30.3187,-93.2002,"Thunderstorms moved very slowly across Lake Charles and the surrounding area while back building during the late morning to mid afternoon of the 17th. One rain gage recorded near 22 inches of rain in South Lake Charles during the event, but a large swath received 10 inches or more. Most streets were flooded and impassable. Numerous vehicles were flooded and some were swept off the roads into ditches and and bayous. One person drown when their car floated into a ditch. Numerous homes and businesses were flooded in South Lake Charles some of which were still being repaired from Hurricanes Laura and Delta. Some schools and churches in the area also flooded.","A cold front moved in and stalled while multiple upper level disturbances moved through. High moisture levels and ample lift provided a few days of flooding and severe thunderstorms.",20
961426,VERMILION PAR.,MAURICE,05/17/2021,1800,Flash Flood, , ,1,0,30000,0,LA,CST-6, ,158930,C,113,LCH,0,0,Broadcast Media,Heavy Rain, , ,0,NW,12,NNE,MAURICE,05/17/2021,2100,30.1233,-92.1345,30.2727,-92.0199,"Heavy rain produced flooding in northeast Vermilion Parish into the city of Lafayette. Several streets were flooded around the community of Maurice where a driver ran off the road. The motorist was found the next day in the ditch near his car.","A cold front moved in and stalled while multiple upper level disturbances moved through. High moisture levels and ample lift provided a few days of flooding and severe thunderstorms.",21
960849,LAFAYETTE PAR.,MILTON,05/17/2021,1800,Flash Flood, , ,0,0,300000,0,LA,CST-6, ,158930,C,55,LCH,0,0,Broadcast Media,Heavy Rain, , ,3,W,4,WNW,MILTON,05/17/2021,2100,30.1029,-92.1278,30.1232,-92.1345,"Numerous streets were flooded around Lafayette with cars stranded at several intersections.","A cold front moved in and stalled while multiple upper level disturbances moved through. High moisture levels and ample lift provided a few days of flooding and severe thunderstorms.",22
960530,EAST BATON ROUGE PAR.,INNISWOLD,05/17/2021,1922,Flash Flood, , ,0,0,3000,0,LA,CST-6, ,158892,C,33,LIX,0,0,Public,Heavy Rain, , ,1,SSE,1,WNW,NESSER,05/17/2021,2022,30.4103,-91.0661,30.4031,-91.0665,"Report of water entering at least one home near Jefferson and Airline highways.","In the overnight hours on May 17th into the early morning on May 18th, a cluster of slow moving severe thunderstorms associated with a weak mid-level disturbance drifted east across southeastern Louisiana. Ample overnight instability and weak steering flow resulted in damaging wind gusts, flash flooding and a few isolated weak tornadoes.",23
960531,EAST BATON ROUGE PAR.,ESSEN,05/17/2021,1948,Flash Flood, , ,0,0,1000,0,LA,CST-6, ,158892,C,33,LIX,0,0,Broadcast Media,Heavy Rain, , ,2,S,2,S,ESSEN,05/17/2021,2048,30.3778,-91.0965,30.3767,-91.0977,"Report of water entering the WVLA NBC Local 33 studio on Bluebonnet and Highway 427.","In the overnight hours on May 17th into the early morning on May 18th, a cluster of slow moving severe thunderstorms associated with a weak mid-level disturbance drifted east across southeastern Louisiana. Ample overnight instability and weak steering flow resulted in damaging wind gusts, flash flooding and a few isolated weak tornadoes.",24
960532,EAST BATON ROUGE PAR.,WESTMINSTER,05/17/2021,2000,Flash Flood, , ,1,0,0,0,LA,CST-6, ,158892,C,33,LIX,0,0,Emergency Manager,Heavy Rain, , ,1,SSW,1,WSW,INNISWOLD,05/17/2021,2100,30.419,-91.0831,30.4159,-91.0866,"An underpass quickly flooded which resulted in one fatality in a car. Time estimated.","In the overnight hours on May 17th into the early morning on May 18th, a cluster of slow moving severe thunderstorms associated with a weak mid-level disturbance drifted east across southeastern Louisiana. Ample overnight instability and weak steering flow resulted in damaging wind gusts, flash flooding and a few isolated weak tornadoes.",25
960538,ASCENSION PAR.,GEISMAR,05/17/2021,2004,Flash Flood, , ,0,0,0,0,LA,CST-6, ,158892,C,5,LIX,0,0,Emergency Manager,Heavy Rain, , ,0,SSE,0,SE,GEISMAR,05/17/2021,2104,30.1954,-91.018,30.1971,-91.0154,"Highway 75 closed at Waterloo Drive due to high water across the road.","In the overnight hours on May 17th into the early morning on May 18th, a cluster of slow moving severe thunderstorms associated with a weak mid-level disturbance drifted east across southeastern Louisiana. Ample overnight instability and weak steering flow resulted in damaging wind gusts, flash flooding and a few isolated weak tornadoes.",26
960533,EAST BATON ROUGE PAR.,FOREMAN,05/17/2021,2007,Flash Flood, , ,0,0,3000,0,LA,CST-6, ,158892,C,33,LIX,0,0,Social Media,Heavy Rain, , ,2,W,2,WSW,FOREMAN,05/17/2021,2107,30.3646,-91.055,30.3625,-91.0477,"Report of water in a home near the intersection of Perkins Road and Pecue Lane.","In the overnight hours on May 17th into the early morning on May 18th, a cluster of slow moving severe thunderstorms associated with a weak mid-level disturbance drifted east across southeastern Louisiana. Ample overnight instability and weak steering flow resulted in damaging wind gusts, flash flooding and a few isolated weak tornadoes.",27
960540,ASCENSION PAR.,DUTCH TOWN,05/17/2021,2009,Flash Flood, , ,0,0,0,0,LA,CST-6, ,158892,C,5,LIX,0,0,Emergency Manager,Heavy Rain, , ,2,NW,2,NNW,DUTCH TOWN,05/17/2021,2109,30.2728,-90.9977,30.2727,-90.9953,"Bluff road at C Braud Road closed due to high water across the road.","In the overnight hours on May 17th into the early morning on May 18th, a cluster of slow moving severe thunderstorms associated with a weak mid-level disturbance drifted east across southeastern Louisiana. Ample overnight instability and weak steering flow resulted in damaging wind gusts, flash flooding and a few isolated weak tornadoes.",28
960541,EAST BATON ROUGE PAR.,WOODLAWN,05/17/2021,2010,Flash Flood, , ,0,0,0,0,LA,CST-6, ,158892,C,33,LIX,0,0,Public,Heavy Rain, , ,1,NNW,1,SSW,JONES CREEK,05/17/2021,2110,30.3956,-91.027,30.4044,-91.0257,"Tennyson Drive reported impassable with water starting to approach a couple of homes.","In the overnight hours on May 17th into the early morning on May 18th, a cluster of slow moving severe thunderstorms associated with a weak mid-level disturbance drifted east across southeastern Louisiana. Ample overnight instability and weak steering flow resulted in damaging wind gusts, flash flooding and a few isolated weak tornadoes.",29
960542,WEST BATON ROUGE PAR.,KABUS,05/17/2021,2045,Flash Flood, , ,1,0,0,0,LA,CST-6, ,158892,C,121,LIX,0,0,Emergency Manager,Heavy Rain, , ,1,SSW,2,WSW,CINCLARE,05/17/2021,2145,30.4631,-91.2581,30.4437,-91.2543,"A vehicle crashed into a flooded canal leading to one fatality. One other remains missing.","In the overnight hours on May 17th into the early morning on May 18th, a cluster of slow moving severe thunderstorms associated with a weak mid-level disturbance drifted east across southeastern Louisiana. Ample overnight instability and weak steering flow resulted in damaging wind gusts, flash flooding and a few isolated weak tornadoes.",30
960544,EAST BATON ROUGE PAR.,ESSEN,05/17/2021,2049,Flash Flood, , ,0,0,0,0,LA,CST-6, ,158892,C,33,LIX,0,0,Public,Heavy Rain, , ,1,N,1,ESE,MAGNOLIA WOODS,05/17/2021,2149,30.4149,-91.099,30.4155,-91.1041,"Scholar Drive impassable due to water covering roads, blocking access to Bonaire Subdivision.","In the overnight hours on May 17th into the early morning on May 18th, a cluster of slow moving severe thunderstorms associated with a weak mid-level disturbance drifted east across southeastern Louisiana. Ample overnight instability and weak steering flow resulted in damaging wind gusts, flash flooding and a few isolated weak tornadoes.",31
960546,IBERVILLE PAR.,ST GABRIEL,05/17/2021,2052,Flash Flood, , ,0,0,0,0,LA,CST-6, ,158892,C,47,LIX,0,0,Social Media,Heavy Rain, , ,1,NE,1,NE,ST GABRIEL,05/17/2021,2152,30.2581,-91.0916,30.2582,-91.088,"Magnolia Drive and Plantation Drive in St. Gabriel impassable due to high water.","In the overnight hours on May 17th into the early morning on May 18th, a cluster of slow moving severe thunderstorms associated with a weak mid-level disturbance drifted east across southeastern Louisiana. Ample overnight instability and weak steering flow resulted in damaging wind gusts, flash flooding and a few isolated weak tornadoes.",32
960547,EAST BATON ROUGE PAR.,MILLERVILLE,05/17/2021,2054,Flash Flood, , ,0,0,0,0,LA,CST-6, ,158892,C,33,LIX,0,0,Social Media,Heavy Rain, , ,1,ESE,2,ESE,MILLERVILLE,05/17/2021,2154,30.4408,-91.0116,30.4436,-90.9999,"Streets impassable due to high water in O'Neal Place Subdivision off O'Neal Lane. Water approaching some homes.","In the overnight hours on May 17th into the early morning on May 18th, a cluster of slow moving severe thunderstorms associated with a weak mid-level disturbance drifted east across southeastern Louisiana. Ample overnight instability and weak steering flow resulted in damaging wind gusts, flash flooding and a few isolated weak tornadoes.",33
960548,ASCENSION PAR.,HOPE VILLA,05/17/2021,2055,Flash Flood, , ,0,0,0,0,LA,CST-6, ,158892,C,5,LIX,0,0,Social Media,Heavy Rain, , ,4,NNW,4,NNW,HOPE VILLA,05/17/2021,2155,30.4027,-90.9998,30.404,-91.0103,"Chadsford Avenue impassable due to high water.","In the overnight hours on May 17th into the early morning on May 18th, a cluster of slow moving severe thunderstorms associated with a weak mid-level disturbance drifted east across southeastern Louisiana. Ample overnight instability and weak steering flow resulted in damaging wind gusts, flash flooding and a few isolated weak tornadoes.",34
960529,EAST BATON ROUGE PAR.,ARLINGTON,05/17/2021,2120,Flash Flood, , ,0,0,5000,0,LA,CST-6, ,158892,C,33,LIX,0,0,Emergency Manager,Heavy Rain, , ,3,NNE,2,NNE,ARLINGTON,05/17/2021,2220,30.3617,-91.077,30.3557,-91.0808,"Report of St. George Fire Department conducting a high water rescue from a home in St. George.","In the overnight hours on May 17th into the early morning on May 18th, a cluster of slow moving severe thunderstorms associated with a weak mid-level disturbance drifted east across southeastern Louisiana. Ample overnight instability and weak steering flow resulted in damaging wind gusts, flash flooding and a few isolated weak tornadoes.",35
960554,ST. CHARLES PAR.,NORCO,05/18/2021,230,Flash Flood, , ,0,0,0,0,LA,CST-6, ,158892,C,89,LIX,0,0,Emergency Manager,Heavy Rain, , ,1,NW,1,W,NORCO,05/18/2021,330,30.009,-90.427,29.9987,-90.4325,"Numerous roads reported impassable in the Norco area.","In the overnight hours on May 17th into the early morning on May 18th, a cluster of slow moving severe thunderstorms associated with a weak mid-level disturbance drifted east across southeastern Louisiana. Ample overnight instability and weak steering flow resulted in damaging wind gusts, flash flooding and a few isolated weak tornadoes.",36
960553,ST. CHARLES PAR.,HAHNVILLE,05/18/2021,230,Flash Flood, , ,0,0,0,0,LA,CST-6, ,158892,C,89,LIX,0,0,Emergency Manager,Heavy Rain, , ,0,N,1,ESE,HAHNVILLE,05/18/2021,330,29.95,-90.45,29.941,-90.4331,"Numerous roads reported impassable in the Hahnville area.","In the overnight hours on May 17th into the early morning on May 18th, a cluster of slow moving severe thunderstorms associated with a weak mid-level disturbance drifted east across southeastern Louisiana. Ample overnight instability and weak steering flow resulted in damaging wind gusts, flash flooding and a few isolated weak tornadoes.",37
960555,ST. CHARLES PAR.,DUFRESNE,05/18/2021,337,Flash Flood, , ,0,0,0,0,LA,CST-6, ,158892,C,89,LIX,0,0,Emergency Manager,Heavy Rain, , ,1,WNW,0,SE,DESTREHAN,05/18/2021,437,29.9537,-90.3895,29.969,-90.3788,"Numerous roads reported impassable in the Destrahan area.","In the overnight hours on May 17th into the early morning on May 18th, a cluster of slow moving severe thunderstorms associated with a weak mid-level disturbance drifted east across southeastern Louisiana. Ample overnight instability and weak steering flow resulted in damaging wind gusts, flash flooding and a few isolated weak tornadoes.",38
960557,ORLEANS PAR.,NEW ORLEANS,05/18/2021,450,Flash Flood, , ,0,0,0,0,LA,CST-6, ,158892,C,71,LIX,0,0,Broadcast Media,Heavy Rain, , ,2,W,2,WSW,NEW ORLEANS,05/18/2021,550,29.9458,-90.1356,29.9319,-90.1359,"Report of several streets impassable in across portions of New Orleans, mostly in the Uptown Area.","In the overnight hours on May 17th into the early morning on May 18th, a cluster of slow moving severe thunderstorms associated with a weak mid-level disturbance drifted east across southeastern Louisiana. Ample overnight instability and weak steering flow resulted in damaging wind gusts, flash flooding and a few isolated weak tornadoes.",39
