EVENT_ID,CZ_NAME_STR,BEGIN_LOCATION,BEGIN_DATE,BEGIN_TIME,EVENT_TYPE,MAGNITUDE,TOR_F_SCALE,DEATHS_DIRECT,INJURIES_DIRECT,DAMAGE_PROPERTY_NUM,DAMAGE_CROPS_NUM,STATE_ABBR,CZ_TIMEZONE,MAGNITUDE_TYPE,EPISODE_ID,CZ_TYPE,CZ_FIPS,WFO,INJURIES_INDIRECT,DEATHS_INDIRECT,SOURCE,FLOOD_CAUSE,TOR_LENGTH,TOR_WIDTH,BEGIN_RANGE,BEGIN_AZIMUTH,END_RANGE,END_AZIMUTH,END_LOCATION,END_DATE,END_TIME,BEGIN_LAT,BEGIN_LON,END_LAT,END_LON,EVENT_NARRATIVE,EPISODE_NARRATIVE,ABSOLUTE_ROWNUMBER
986776,TANGIPAHOA PAR.,LORANGER,09/15/2021,305,Flash Flood, , ,0,0,0,0,LA,CST-6, ,163434,C,105,LIX,0,0,Law Enforcement,Heavy Rain, , ,3,NNE,3,S,LORANGER,09/15/2021,305,30.67,-90.39,30.5933,-90.4078,"Local law enforcement reported numerous roads closed across the parish due to flooding.","Tropical Storm Nicholas made landfall on the Texas coast south of Houston early Tuesday morning on September 14th. Over the next 24 hours, the weakening storm slowly tracked east-northeast along the coastline, reaching the LA/TX border Wednesday morning. During the 14th and 15th, outer bands of Nicholas expanded east across southeast Louisiana. The persistent rain from those banding features produced areas of flash flooding.",107
986606,EVANGELINE PAR.,TATE COVE,09/15/2021,434,Flash Flood, , ,0,0,0,0,LA,CST-6, ,163404,C,39,LCH,0,0,Department of Highways,Heavy Rain, , ,1,S,2,WSW,GRAND PRARIE,09/15/2021,634,30.7101,-92.2479,30.669,-92.1814,"All lanes of US 167 were flooded and closed from LA 748 to the Evangeline/Saint Landry Parish Line. Rainfall totals were 6 to 11 inches over a 6 hour period.","Hurricane Nicholas moved into the central Texas coast early on the 14th. The remnants of the system moved into Louisiana the late on the 14th then drifted around the state causing flooding.",108
986777,LIVINGSTON PAR.,CORBIN,09/15/2021,515,Flash Flood, , ,0,0,0,0,LA,CST-6, ,163434,C,63,LIX,0,0,Public,Heavy Rain, , ,1,SE,1,SSE,CORBIN,09/15/2021,515,30.49,-90.84,30.4798,-90.8451,"A member of the public reported multiple closed roads in Walker due to flooding via social media.","Tropical Storm Nicholas made landfall on the Texas coast south of Houston early Tuesday morning on September 14th. Over the next 24 hours, the weakening storm slowly tracked east-northeast along the coastline, reaching the LA/TX border Wednesday morning. During the 14th and 15th, outer bands of Nicholas expanded east across southeast Louisiana. The persistent rain from those banding features produced areas of flash flooding.",109
986778,LIVINGSTON PAR.,LOCKHART,09/15/2021,530,Flash Flood, , ,0,0,0,0,LA,CST-6, ,163434,C,63,LIX,0,0,Broadcast Media,Heavy Rain, , ,1,WNW,1,ENE,DENHAM SPGS,09/15/2021,530,30.49,-90.92,30.4892,-90.9305,"Eden Church road was impassable and barricaded due to being flooded.","Tropical Storm Nicholas made landfall on the Texas coast south of Houston early Tuesday morning on September 14th. Over the next 24 hours, the weakening storm slowly tracked east-northeast along the coastline, reaching the LA/TX border Wednesday morning. During the 14th and 15th, outer bands of Nicholas expanded east across southeast Louisiana. The persistent rain from those banding features produced areas of flash flooding.",110
986779,LIVINGSTON PAR.,SATSUMA,09/15/2021,545,Flash Flood, , ,0,0,0,0,LA,CST-6, ,163434,C,63,LIX,0,0,Broadcast Media,Heavy Rain, , ,2,SSW,2,ESE,WALKER,09/15/2021,545,30.47,-90.82,30.47,-90.8421,"The corner of Chelsea Street and Black Mud Road was barricaded due to flooding.","Tropical Storm Nicholas made landfall on the Texas coast south of Houston early Tuesday morning on September 14th. Over the next 24 hours, the weakening storm slowly tracked east-northeast along the coastline, reaching the LA/TX border Wednesday morning. During the 14th and 15th, outer bands of Nicholas expanded east across southeast Louisiana. The persistent rain from those banding features produced areas of flash flooding.",111
986781,LIVINGSTON PAR.,ALBANY,09/15/2021,600,Flash Flood, , ,0,0,0,0,LA,CST-6, ,163434,C,63,LIX,0,0,Broadcast Media,Heavy Rain, , ,4,NW,2,NW,ALBANY,09/15/2021,600,30.55,-90.62,30.5246,-90.6074,"The intersection of Pea Ridge and Wagner roads were impassible due to high water.","Tropical Storm Nicholas made landfall on the Texas coast south of Houston early Tuesday morning on September 14th. Over the next 24 hours, the weakening storm slowly tracked east-northeast along the coastline, reaching the LA/TX border Wednesday morning. During the 14th and 15th, outer bands of Nicholas expanded east across southeast Louisiana. The persistent rain from those banding features produced areas of flash flooding.",112
986782,LIVINGSTON PAR.,ALBANY,09/15/2021,615,Flash Flood, , ,0,0,0,0,LA,CST-6, ,163434,C,63,LIX,0,0,Broadcast Media,Heavy Rain, , ,3,NNE,3,NNW,ALBANY,09/15/2021,615,30.54,-90.57,30.5387,-90.5939,"North Cafe Line Road from Drake Lane to Highway 1064 was impassible due to high water.","Tropical Storm Nicholas made landfall on the Texas coast south of Houston early Tuesday morning on September 14th. Over the next 24 hours, the weakening storm slowly tracked east-northeast along the coastline, reaching the LA/TX border Wednesday morning. During the 14th and 15th, outer bands of Nicholas expanded east across southeast Louisiana. The persistent rain from those banding features produced areas of flash flooding.",113
986783,WASHINGTON PAR.,LEES CREEK,09/15/2021,615,Flash Flood, , ,0,0,0,0,LA,CST-6, ,163434,C,117,LIX,0,0,Broadcast Media,Heavy Rain, , ,1,S,1,W,LEES CREEK,09/15/2021,615,30.72,-89.87,30.7266,-89.8926,"Several roads were flooded around the Lees Creek area.","Tropical Storm Nicholas made landfall on the Texas coast south of Houston early Tuesday morning on September 14th. Over the next 24 hours, the weakening storm slowly tracked east-northeast along the coastline, reaching the LA/TX border Wednesday morning. During the 14th and 15th, outer bands of Nicholas expanded east across southeast Louisiana. The persistent rain from those banding features produced areas of flash flooding.",114
986609,VERNON PAR.,BURR FERRY,09/28/2021,637,Flash Flood, , ,0,0,25000,0,LA,CST-6, ,163405,C,115,LCH,0,0,NWS Employee,Heavy Rain, , ,7,N,2,SSE,LACAMP,09/28/2021,837,31.1658,-93.5031,31.1423,-92.9182,"Slow moving heavy thunderstorm produced flooding at Fort Polk and along multiple roads in Vernon Parish. NWS equipment flooded at Fort Polk.","A very moist air mass interacted with a passing upper disturbance. High rainfall rates and slow storm motion allowed flash flooding to occur.",115
986610,BEAUREGARD PAR.,DE RIDDER,09/28/2021,955,Flash Flood, , ,0,0,0,0,LA,CST-6, ,163405,C,11,LCH,0,0,Public,Heavy Rain, , ,1,WNW,1,ENE,DE RIDDER,09/28/2021,1155,30.86,-93.3,30.8556,-93.2692,"Multiple streets were flooded and impassable in Deridder.","A very moist air mass interacted with a passing upper disturbance. High rainfall rates and slow storm motion allowed flash flooding to occur.",116
986612,CALCASIEU PAR.,(LCH)LK CHARLES MUNI,09/28/2021,1238,Flash Flood, , ,0,0,0,0,LA,CST-6, ,163405,C,19,LCH,0,0,Public,Heavy Rain, , ,1,NE,2,WNW,(LCH)LK CHARLES MUNI,09/28/2021,1338,30.137,-93.2128,30.1395,-93.2519,"Heavy rain produced street flooding in South Lake Charles.","A very moist air mass interacted with a passing upper disturbance. High rainfall rates and slow storm motion allowed flash flooding to occur.",117
986770,ST. BERNARD PAR.,VERSAILLES,09/28/2021,1700,Flash Flood, , ,0,0,0,0,LA,CST-6, ,163439,C,87,LIX,0,0,Law Enforcement,Heavy Rain, , ,1,S,1,SW,VERSAILLES,09/28/2021,1830,29.94,-89.95,29.9401,-89.9596,"Veronica Drive in Chalmette was impassible due to high water.","Gulf moisture surging into the local area pushed precipitable water values to above the 90th percentile for this time of year. At the same time, an upper level trough was digging into Texas. Showers and thunderstorms began developing ahead of this feature. A weak wind field in place was a prime environment for a slow moving storm to produce flash flooding.",118
987479,CATAHOULA PAR.,HARRISONBURG,10/02/2021,1532,Flash Flood, , ,0,0,5000,0,LA,CST-6, ,163561,C,25,JAN,0,0,Law Enforcement,Heavy Rain, , ,1,ENE,1,E,HARRISONBURG,10/02/2021,1645,31.7738,-91.8136,31.7707,-91.8164,"Highway was flooded and impassable.","Showers and thunderstorms occurred as a cold front interacted with a warm, moist airmass. This resulted in some flooding in northeast Louisiana.",119
987475,CATAHOULA PAR.,SICILY IS,10/02/2021,1600,Flash Flood, , ,0,0,15000,0,LA,CST-6, ,163561,C,25,JAN,0,0,Law Enforcement,Heavy Rain, , ,3,WNW,3,N,LELAND,10/02/2021,1645,31.87,-91.71,31.8694,-91.7183,"A culvert was washed out and the road was impassable.","Showers and thunderstorms occurred as a cold front interacted with a warm, moist airmass. This resulted in some flooding in northeast Louisiana.",120
989857,WASHINGTON PAR.,FRANKLINTON ARPT,10/27/2021,1700,Flash Flood, , ,0,0,0,0,LA,CST-6, ,163970,C,117,LIX,0,0,Law Enforcement,Heavy Rain, , ,2,NNE,1,N,FRANKLINTON ARPT,10/27/2021,1800,30.8463,-90.1117,30.8296,-90.1215,"Washington Parish Sheriffs office reported street flooding on Highway 10 near Bogue Chitto Heights.","A warm front lifted north across the local area during the morning hours. This brought in a surge of warm and moist air. At the same time, mid level temperatures were dropping. That combination dramatically increased instability across the region. A line of thunderstorms and discrete cells ahead of the cold front developed and produced a few tornadoes, flash flooding, and damaging wind gusts.",121
999676,EAST BATON ROUGE PAR.,BATON ROUGE,12/06/2021,1455,Flash Flood, , ,0,0,0,0,LA,CST-6, ,165384,C,33,LIX,0,0,Emergency Manager,Heavy Rain, , ,1,S,1,S,BATON ROUGE,12/06/2021,1645,30.46,-91.17,30.4539,-91.1682,"East Baton Rouge Parish emergency manager reported closure of I-110 at the governors mansion curve due to high water.","Temperatures soared into the low 80s, nearly breaking record highs for the day, just ahead of an approaching cold front. These warm and moist conditions created ample instability that, when combined with increasing wind shear from upper level system just north of the region, supported the development of severe thunderstorms and heavy rainfall. This system spawned one tornado and scattered areas of wind damage.",122
1009729,WASHINGTON PAR.,BOGALUSA ARPT,02/03/2022,1202,Flash Flood, , ,0,0,30000,0,LA,CST-6, ,166887,C,117,LIX,0,0,Law Enforcement,Heavy Rain, , ,1,WSW,0,SW,BOGALUSA ARPT,02/03/2022,1302,30.7964,-89.8645,30.7965,-89.8536,"A car was swept off the road on Washington Street across from Northshore Charter School in Bogalusa. A water rescue was performed by local law enforcement and the person sustained no injuries.","A cold front moving through the local area began to slow down its eastward progression as it reached southeast Louisiana. Thunderstorms along the boundary started training over the same areas due to the slowing down of the cold front. This resulted in multiple areas of flash flooding across the region. Property damage was fairly minimal but dozens of streets across different cities became impassable.",123
1009730,WASHINGTON PAR.,BOGALUSA ARPT,02/03/2022,1253,Flash Flood, , ,0,0,0,0,LA,CST-6, ,166887,C,117,LIX,0,0,Emergency Manager,Heavy Rain, , ,2,WSW,2,NNW,LEES CREEK,02/03/2022,1353,30.79,-89.88,30.7555,-89.8794,"Washington Parish Emergency Management agency reported multiple streets flooded across the city of Bogalusa.","A cold front moving through the local area began to slow down its eastward progression as it reached southeast Louisiana. Thunderstorms along the boundary started training over the same areas due to the slowing down of the cold front. This resulted in multiple areas of flash flooding across the region. Property damage was fairly minimal but dozens of streets across different cities became impassable.",124
1009732,ST. TAMMANY PAR.,MANDEVILLE,02/03/2022,1358,Flash Flood, , ,0,0,0,0,LA,CST-6, ,166887,C,103,LIX,0,0,NWS Employee,Heavy Rain, , ,3,ENE,3,E,MANDEVILLE,02/03/2022,1429,30.37,-90.04,30.355,-90.0483,"NWS employee reported multiple impassable streets in Mandeville due to heavy rainfall.","A cold front moving through the local area began to slow down its eastward progression as it reached southeast Louisiana. Thunderstorms along the boundary started training over the same areas due to the slowing down of the cold front. This resulted in multiple areas of flash flooding across the region. Property damage was fairly minimal but dozens of streets across different cities became impassable.",125
1009733,ORLEANS PAR.,VIEUX CARRE,02/03/2022,1458,Flash Flood, , ,0,0,0,0,LA,CST-6, ,166887,C,71,LIX,0,0,Mesonet,Heavy Rain, , ,2,NNE,1,N,VIEUX CARRE,02/03/2022,1558,29.9952,-90.073,29.9839,-90.078,"Local street water height gauge measured water up to 3 feet at the underpass of I-610 and Paris Avenue.","A cold front moving through the local area began to slow down its eastward progression as it reached southeast Louisiana. Thunderstorms along the boundary started training over the same areas due to the slowing down of the cold front. This resulted in multiple areas of flash flooding across the region. Property damage was fairly minimal but dozens of streets across different cities became impassable.",126
1009734,ST. TAMMANY PAR.,CHINCHUBA,02/03/2022,1523,Flash Flood, , ,0,0,0,0,LA,CST-6, ,166887,C,103,LIX,0,0,Public,Heavy Rain, , ,0,N,1,NE,LEWISBURG,02/03/2022,1610,30.4,-90.08,30.376,-90.0939,"A member of the public reported several impassable streets in Mandeville due to high water covering the roadways. Several barricades were in place.","A cold front moving through the local area began to slow down its eastward progression as it reached southeast Louisiana. Thunderstorms along the boundary started training over the same areas due to the slowing down of the cold front. This resulted in multiple areas of flash flooding across the region. Property damage was fairly minimal but dozens of streets across different cities became impassable.",127
1009731,ST. JOHN THE BAPTIST PAR.,LA PLACE,02/03/2022,1605,Flash Flood, , ,0,0,0,0,LA,CST-6, ,166887,C,95,LIX,0,0,Emergency Manager,Heavy Rain, , ,1,W,1,SE,LA PLACE,02/03/2022,1705,30.07,-90.49,30.0583,-90.4706,"The local emergency management agency was putting up several barricades across Laplace due to flooded roadways.","A cold front moving through the local area began to slow down its eastward progression as it reached southeast Louisiana. Thunderstorms along the boundary started training over the same areas due to the slowing down of the cold front. This resulted in multiple areas of flash flooding across the region. Property damage was fairly minimal but dozens of streets across different cities became impassable.",128
1009539,CADDO PAR.,(SHV)SHREVEPORT RGNL,03/22/2022,233,Flash Flood, , ,0,0,0,0,LA,CST-6, ,166856,C,17,SHV,0,0,Fire Department/Rescue,Heavy Rain, , ,1,ENE,1,ENE,(SHV)SHREVEPORT RGNL,03/22/2022,415,32.4569,-93.8107,32.4568,-93.8099,"Cars were flooded at the intersection of Hollywood Avenue and Kennedy Drive.","A closed upper low emerged out of the Rockies and into the Central Plains during the afternoon and evening hours of March 21st, with the attendant upper trough swinging east through Central Texas and Oklahoma. Strong southerly low level winds allowed for the rapid return of warm, moist, and unstable air north behind a warm front which lifted north through East Texas and North Louisiana. Large scale forcing began to increase across Northern and Central Texas during the evening, with showers and thunderstorms becoming numerous across this area which spread into North Louisiana during the early morning hours of the 22nd. Given the extent of forcing within the unstable air mass in place, severe thunderstorms developed over North-central Texas and spread into East Texas and North Louisiana, resulting in numerous reports of damaging winds. Redevelopment of these storms continued overnight as well over the same areas of East Texas and Northwest Louisiana, which resulted in instances of flash flooding as well, as widespread rainfall amounts of 3-6 inches fell over these areas. These storms diminished during the early morning hours of the 22nd with the passage of a cold front through the region.",129
1009540,WEBSTER PAR.,SPRINGHILL,03/22/2022,234,Flash Flood, , ,0,0,0,0,LA,CST-6, ,166856,C,119,SHV,0,0,Public,Heavy Rain, , ,0,SE,0,WSW,SPRINGHILL,03/22/2022,415,32.9962,-93.4649,32.9972,-93.4771,"Several streets were flooded and closed in Springhill. Vehicles were stalled in high water. Report from mPING.","A closed upper low emerged out of the Rockies and into the Central Plains during the afternoon and evening hours of March 21st, with the attendant upper trough swinging east through Central Texas and Oklahoma. Strong southerly low level winds allowed for the rapid return of warm, moist, and unstable air north behind a warm front which lifted north through East Texas and North Louisiana. Large scale forcing began to increase across Northern and Central Texas during the evening, with showers and thunderstorms becoming numerous across this area which spread into North Louisiana during the early morning hours of the 22nd. Given the extent of forcing within the unstable air mass in place, severe thunderstorms developed over North-central Texas and spread into East Texas and North Louisiana, resulting in numerous reports of damaging winds. Redevelopment of these storms continued overnight as well over the same areas of East Texas and Northwest Louisiana, which resulted in instances of flash flooding as well, as widespread rainfall amounts of 3-6 inches fell over these areas. These storms diminished during the early morning hours of the 22nd with the passage of a cold front through the region.",130
1009546,CADDO PAR.,LORRAINE,03/22/2022,246,Flash Flood, , ,0,0,0,0,LA,CST-6, ,166856,C,17,SHV,0,0,Law Enforcement,Heavy Rain, , ,3,N,1,SE,BLANCHARD,03/22/2022,415,32.5077,-94.0362,32.5716,-93.8669,"Flooding was reported on I-20 East at Mile Marker 4, Roy Road at MLK Drive, Highway 173 and North Lakeshore Drive, Highway 173 and Bostwick, Waterwood Drive at West 70th Street, Starwood Lane at West Starwood in Greenwood. Three motorists were rescued from high water.","A closed upper low emerged out of the Rockies and into the Central Plains during the afternoon and evening hours of March 21st, with the attendant upper trough swinging east through Central Texas and Oklahoma. Strong southerly low level winds allowed for the rapid return of warm, moist, and unstable air north behind a warm front which lifted north through East Texas and North Louisiana. Large scale forcing began to increase across Northern and Central Texas during the evening, with showers and thunderstorms becoming numerous across this area which spread into North Louisiana during the early morning hours of the 22nd. Given the extent of forcing within the unstable air mass in place, severe thunderstorms developed over North-central Texas and spread into East Texas and North Louisiana, resulting in numerous reports of damaging winds. Redevelopment of these storms continued overnight as well over the same areas of East Texas and Northwest Louisiana, which resulted in instances of flash flooding as well, as widespread rainfall amounts of 3-6 inches fell over these areas. These storms diminished during the early morning hours of the 22nd with the passage of a cold front through the region.",131
1009548,CADDO PAR.,KEITHVILLE ARPT,03/22/2022,246,Flash Flood, , ,0,0,0,0,LA,CST-6, ,166856,C,17,SHV,0,0,Law Enforcement,Heavy Rain, , ,1,W,0,W,KEITHVILLE ARPT,03/22/2022,415,32.3509,-93.8292,32.3511,-93.8272,"Flooding was reported at Highway 171 and Old Mansfield Road.","A closed upper low emerged out of the Rockies and into the Central Plains during the afternoon and evening hours of March 21st, with the attendant upper trough swinging east through Central Texas and Oklahoma. Strong southerly low level winds allowed for the rapid return of warm, moist, and unstable air north behind a warm front which lifted north through East Texas and North Louisiana. Large scale forcing began to increase across Northern and Central Texas during the evening, with showers and thunderstorms becoming numerous across this area which spread into North Louisiana during the early morning hours of the 22nd. Given the extent of forcing within the unstable air mass in place, severe thunderstorms developed over North-central Texas and spread into East Texas and North Louisiana, resulting in numerous reports of damaging winds. Redevelopment of these storms continued overnight as well over the same areas of East Texas and Northwest Louisiana, which resulted in instances of flash flooding as well, as widespread rainfall amounts of 3-6 inches fell over these areas. These storms diminished during the early morning hours of the 22nd with the passage of a cold front through the region.",132
1009574,DE SOTO PAR.,STONEWALL,03/22/2022,300,Flash Flood, , ,0,0,0,0,LA,CST-6, ,166856,C,31,SHV,0,0,Law Enforcement,Heavy Rain, , ,1,WNW,5,NE,STONEWALL,03/22/2022,500,32.2844,-93.8359,32.3379,-93.7628,"Numerous roads were flooded throughout Desoto Parish. These included Twin Oaks Road, Bluntmill Road, Missile Base Road near Prairie Lane, Stonewall Frierson Road near Edgewood Lane, Long Road near Highway 5, Bethel Road at Thomas Road, Red Bluff Road at Case Lane, Highway 3015 and Highway 175, Church Road at Stanley Road, Stonewall Preston Road at Candy Lane, Linwood Avenue north of Clayton Road, Cody Drive, English Road, Jesse Latin Road, and near Cash Butler Road.","A closed upper low emerged out of the Rockies and into the Central Plains during the afternoon and evening hours of March 21st, with the attendant upper trough swinging east through Central Texas and Oklahoma. Strong southerly low level winds allowed for the rapid return of warm, moist, and unstable air north behind a warm front which lifted north through East Texas and North Louisiana. Large scale forcing began to increase across Northern and Central Texas during the evening, with showers and thunderstorms becoming numerous across this area which spread into North Louisiana during the early morning hours of the 22nd. Given the extent of forcing within the unstable air mass in place, severe thunderstorms developed over North-central Texas and spread into East Texas and North Louisiana, resulting in numerous reports of damaging winds. Redevelopment of these storms continued overnight as well over the same areas of East Texas and Northwest Louisiana, which resulted in instances of flash flooding as well, as widespread rainfall amounts of 3-6 inches fell over these areas. These storms diminished during the early morning hours of the 22nd with the passage of a cold front through the region.",133
1009570,CADDO PAR.,FORBING,03/22/2022,300,Flash Flood, , ,0,0,0,0,LA,CST-6, ,166856,C,17,SHV,0,0,Broadcast Media,Heavy Rain, , ,1,SW,1,SW,FORBING,03/22/2022,415,32.3929,-93.7413,32.3924,-93.7411,"Oak Ridge Drive was flooded.","A closed upper low emerged out of the Rockies and into the Central Plains during the afternoon and evening hours of March 21st, with the attendant upper trough swinging east through Central Texas and Oklahoma. Strong southerly low level winds allowed for the rapid return of warm, moist, and unstable air north behind a warm front which lifted north through East Texas and North Louisiana. Large scale forcing began to increase across Northern and Central Texas during the evening, with showers and thunderstorms becoming numerous across this area which spread into North Louisiana during the early morning hours of the 22nd. Given the extent of forcing within the unstable air mass in place, severe thunderstorms developed over North-central Texas and spread into East Texas and North Louisiana, resulting in numerous reports of damaging winds. Redevelopment of these storms continued overnight as well over the same areas of East Texas and Northwest Louisiana, which resulted in instances of flash flooding as well, as widespread rainfall amounts of 3-6 inches fell over these areas. These storms diminished during the early morning hours of the 22nd with the passage of a cold front through the region.",134
1009565,CADDO PAR.,FORBING,03/22/2022,300,Flash Flood, , ,0,0,0,0,LA,CST-6, ,166856,C,17,SHV,0,0,Public,Heavy Rain, , ,1,SW,1,SSW,FORBING,03/22/2022,415,32.3906,-93.738,32.3903,-93.7344,"Flooding was reported in the Lucien Fields subdivision in South Shreveport.","A closed upper low emerged out of the Rockies and into the Central Plains during the afternoon and evening hours of March 21st, with the attendant upper trough swinging east through Central Texas and Oklahoma. Strong southerly low level winds allowed for the rapid return of warm, moist, and unstable air north behind a warm front which lifted north through East Texas and North Louisiana. Large scale forcing began to increase across Northern and Central Texas during the evening, with showers and thunderstorms becoming numerous across this area which spread into North Louisiana during the early morning hours of the 22nd. Given the extent of forcing within the unstable air mass in place, severe thunderstorms developed over North-central Texas and spread into East Texas and North Louisiana, resulting in numerous reports of damaging winds. Redevelopment of these storms continued overnight as well over the same areas of East Texas and Northwest Louisiana, which resulted in instances of flash flooding as well, as widespread rainfall amounts of 3-6 inches fell over these areas. These storms diminished during the early morning hours of the 22nd with the passage of a cold front through the region.",135
