EVENT_ID,CZ_NAME_STR,BEGIN_LOCATION,BEGIN_DATE,BEGIN_TIME,EVENT_TYPE,MAGNITUDE,TOR_F_SCALE,DEATHS_DIRECT,INJURIES_DIRECT,DAMAGE_PROPERTY_NUM,DAMAGE_CROPS_NUM,STATE_ABBR,CZ_TIMEZONE,MAGNITUDE_TYPE,EPISODE_ID,CZ_TYPE,CZ_FIPS,WFO,INJURIES_INDIRECT,DEATHS_INDIRECT,SOURCE,FLOOD_CAUSE,TOR_LENGTH,TOR_WIDTH,BEGIN_RANGE,BEGIN_AZIMUTH,END_RANGE,END_AZIMUTH,END_LOCATION,END_DATE,END_TIME,BEGIN_LAT,BEGIN_LON,END_LAT,END_LON,EVENT_NARRATIVE,EPISODE_NARRATIVE,ABSOLUTE_ROWNUMBER
974416,JEFFERSON PAR.,(MSY)MOISANT FLD NEW,07/03/2021,1545,Flash Flood, , ,0,0,0,0,LA,CST-6, ,161353,C,51,LIX,0,0,Law Enforcement,Heavy Rain, , ,1,SE,1,S,(MSY)MOISANT FLD NEW,07/03/2021,1545,29.99,-90.24,29.9914,-90.2491,"Report of scattered road barriers/road closings throughout the city of Kenner from flash flooding.","In the afternoon and evening hours on July 2nd, a stalled frontal boundary draped across northern Louisiana, central Mississippi and Alabama. This left moist, unstable air across southern Louisiana and much drier continental air to the north. This boundary, along with a upper-level weak disturbance helped ignite slow-moving scattered showers and thunderstorms that led to flash flooding.",77
974419,ST. BERNARD PAR.,VERSAILLES,07/05/2021,340,Flash Flood, , ,0,0,0,0,LA,CST-6, ,161355,C,87,LIX,0,0,Public,Heavy Rain, , ,1,S,1,S,VERSAILLES,07/05/2021,340,29.94,-89.95,29.938,-89.9509,"Street closed due to flash flooding.","In the early morning hours on July 5th, a cluster of slow moving thunderstorms caused by a nearby stalled frontal boundary and weak upper-level disturbance delivered areas of flash flooding across southeastern Louisiana.",78
974420,ORLEANS PAR.,CUTOFF,07/05/2021,342,Flash Flood, , ,0,0,0,0,LA,CST-6, ,161355,C,71,LIX,0,0,Public,Heavy Rain, , ,2,SSE,1,SSE,CUTOFF,07/05/2021,342,29.9,-89.99,29.9006,-89.9904,"Street closed due to flash flooding.","In the early morning hours on July 5th, a cluster of slow moving thunderstorms caused by a nearby stalled frontal boundary and weak upper-level disturbance delivered areas of flash flooding across southeastern Louisiana.",79
974430,ST. TAMMANY PAR.,HOULTONVILLE,07/07/2021,315,Flash Flood, , ,0,0,0,0,LA,CST-6, ,161358,C,103,LIX,0,0,Public,Heavy Rain, , ,2,NNE,1,NNE,HOULTONVILLE,07/07/2021,315,30.4248,-90.1553,30.419,-90.1592,"Several streets reported flooded near Highway 21 and Dummyline Rd.","A flash flooding event occurred due a stalled frontal boundary in place helping to supply environmental lift along with ample Gulf moisture to produce slow-moving clusters of showers and thunderstorms. This event impacted the local area of southeastern Louisiana in the early morning on July 7th.",80
974447,ORLEANS PAR.,VIEUX CARRE,07/16/2021,1238,Flash Flood, , ,0,0,0,0,LA,CST-6, ,161365,C,71,LIX,0,0,Emergency Manager,Heavy Rain, , ,2,N,2,NNE,VIEUX CARRE,07/16/2021,1238,29.9943,-90.0749,29.9983,-90.0641,"Report of high water on the Paris Avenue underpass near Gentilly Boulevard. High water reported across roads in the area.","In the afternoon hours on July 16th, isolated thunderstorms developed due to very moisture rich Gulf air in place combined with ample afternoon destabilization. Weak wind flow aloft allowed for slow movement with these storms leading to isolated areas of flash flooding to develop.",81
974449,ST. TAMMANY PAR.,CHINCHUBA,07/20/2021,119,Flash Flood, , ,0,0,30000,0,LA,CST-6, ,161367,C,103,LIX,0,0,Law Enforcement,Heavy Rain, , ,1,SE,1,SE,CHINCHUBA,07/20/2021,119,30.39,-90.07,30.3864,-90.0623,"Water entering several homes. many roads impassable and barricaded.","In the morning hours on July 20th, 2021, slow moving thunderstorms developed overnight ,one specific cluster formed over the Northshore that led to significant flooding, with areas of flooding elsewhere from developing clusters of thunderstorms through the morning hours. These storms formed within a rich Gulf, unstable airmass out ahead of an approaching outflow boundary and slow moving cold front from the west.",82
974450,ST. TAMMANY PAR.,CHINCHUBA,07/20/2021,215,Flash Flood, , ,0,0,50000,0,LA,CST-6, ,161367,C,103,LIX,0,0,Public,Heavy Rain, , ,0,N,1,E,CHINCHUBA,07/20/2021,215,30.4,-90.08,30.3988,-90.0659,"A social media video showed at least a dozen flooded cars in an apartment complex in Mandeville.","In the morning hours on July 20th, 2021, slow moving thunderstorms developed overnight ,one specific cluster formed over the Northshore that led to significant flooding, with areas of flooding elsewhere from developing clusters of thunderstorms through the morning hours. These storms formed within a rich Gulf, unstable airmass out ahead of an approaching outflow boundary and slow moving cold front from the west.",83
974451,ST. TAMMANY PAR.,CHINCHUBA,07/20/2021,230,Flash Flood, , ,0,0,0,0,LA,CST-6, ,161367,C,103,LIX,0,0,Public,Heavy Rain, , ,1,SW,1,NNE,LEWISBURG,07/20/2021,230,30.39,-90.09,30.384,-90.0907,"Public reported service road was impassable in Mandeville due to high water.","In the morning hours on July 20th, 2021, slow moving thunderstorms developed overnight ,one specific cluster formed over the Northshore that led to significant flooding, with areas of flooding elsewhere from developing clusters of thunderstorms through the morning hours. These storms formed within a rich Gulf, unstable airmass out ahead of an approaching outflow boundary and slow moving cold front from the west.",84
974452,ST. TAMMANY PAR.,CHINCHUBA,07/20/2021,546,Flash Flood, , ,0,0,0,0,LA,CST-6, ,161367,C,103,LIX,0,0,Broadcast Media,Heavy Rain, , ,1,NNE,1,ESE,CHINCHUBA,07/20/2021,546,30.4106,-90.0742,30.3908,-90.0589,"Flooding outside Cypress Lake apartments in Mandeville. Roads completely impassable.","In the morning hours on July 20th, 2021, slow moving thunderstorms developed overnight ,one specific cluster formed over the Northshore that led to significant flooding, with areas of flooding elsewhere from developing clusters of thunderstorms through the morning hours. These storms formed within a rich Gulf, unstable airmass out ahead of an approaching outflow boundary and slow moving cold front from the west.",85
974454,ST. TAMMANY PAR.,COVINGTON,07/20/2021,550,Flash Flood, , ,0,0,20000,0,LA,CST-6, ,161367,C,103,LIX,0,0,Public,Heavy Rain, , ,2,NNW,1,NNW,COVINGTON,07/20/2021,550,30.5,-90.11,30.4983,-90.1128,"Public reports ankle deep water entering their apartment.","In the morning hours on July 20th, 2021, slow moving thunderstorms developed overnight ,one specific cluster formed over the Northshore that led to significant flooding, with areas of flooding elsewhere from developing clusters of thunderstorms through the morning hours. These storms formed within a rich Gulf, unstable airmass out ahead of an approaching outflow boundary and slow moving cold front from the west.",86
974455,ST. TAMMANY PAR.,CLAIBORNE,07/20/2021,619,Flash Flood, , ,0,0,0,0,LA,CST-6, ,161367,C,103,LIX,0,0,NWS Employee,Heavy Rain, , ,2,S,2,N,CHINCHUBA,07/20/2021,619,30.4383,-90.0837,30.4346,-90.0842,"NWS employed reported Holiday Square Boulevard to be an impassable due to high water.","In the morning hours on July 20th, 2021, slow moving thunderstorms developed overnight ,one specific cluster formed over the Northshore that led to significant flooding, with areas of flooding elsewhere from developing clusters of thunderstorms through the morning hours. These storms formed within a rich Gulf, unstable airmass out ahead of an approaching outflow boundary and slow moving cold front from the west.",87
974456,ST. TAMMANY PAR.,HOULTONVILLE,07/20/2021,646,Flash Flood, , ,0,0,25000,0,LA,CST-6, ,161367,C,103,LIX,0,0,Broadcast Media,Heavy Rain, , ,1,E,1,E,HOULTONVILLE,07/20/2021,646,30.4,-90.16,30.4,-90.1569,"Social media picture showing water entering gas station.","In the morning hours on July 20th, 2021, slow moving thunderstorms developed overnight ,one specific cluster formed over the Northshore that led to significant flooding, with areas of flooding elsewhere from developing clusters of thunderstorms through the morning hours. These storms formed within a rich Gulf, unstable airmass out ahead of an approaching outflow boundary and slow moving cold front from the west.",88
974457,ST. TAMMANY PAR.,CHINCHUBA,07/20/2021,715,Flash Flood, , ,0,0,0,0,LA,CST-6, ,161367,C,103,LIX,0,0,Broadcast Media,Heavy Rain, , ,1,N,0,WNW,CHINCHUBA,07/20/2021,715,30.41,-90.08,30.4025,-90.0844,"Tall Timbers has multiple roads impassable water and encroaching on homes.","In the morning hours on July 20th, 2021, slow moving thunderstorms developed overnight ,one specific cluster formed over the Northshore that led to significant flooding, with areas of flooding elsewhere from developing clusters of thunderstorms through the morning hours. These storms formed within a rich Gulf, unstable airmass out ahead of an approaching outflow boundary and slow moving cold front from the west.",89
974458,ST. TAMMANY PAR.,MANDEVILLE,07/20/2021,803,Flash Flood, , ,0,0,0,0,LA,CST-6, ,161367,C,103,LIX,0,0,NWS Employee,Heavy Rain, , ,2,E,2,E,MANDEVILLE,07/20/2021,803,30.36,-90.05,30.3538,-90.0536,"Roads are beginning to hold water in Monterrey and starting to approaches houses.","In the morning hours on July 20th, 2021, slow moving thunderstorms developed overnight ,one specific cluster formed over the Northshore that led to significant flooding, with areas of flooding elsewhere from developing clusters of thunderstorms through the morning hours. These storms formed within a rich Gulf, unstable airmass out ahead of an approaching outflow boundary and slow moving cold front from the west.",90
974459,ST. TAMMANY PAR.,MANDEVILLE,07/20/2021,859,Flash Flood, , ,0,0,0,0,LA,CST-6, ,161367,C,103,LIX,0,0,Broadcast Media,Heavy Rain, , ,2,E,2,E,MANDEVILLE,07/20/2021,859,30.36,-90.06,30.3618,-90.0584,"Social media photo shows car wash and surrounding road flooded.","In the morning hours on July 20th, 2021, slow moving thunderstorms developed overnight ,one specific cluster formed over the Northshore that led to significant flooding, with areas of flooding elsewhere from developing clusters of thunderstorms through the morning hours. These storms formed within a rich Gulf, unstable airmass out ahead of an approaching outflow boundary and slow moving cold front from the west.",91
974460,ST. TAMMANY PAR.,MANDEVILLE,07/20/2021,907,Flash Flood, , ,0,0,45000,0,LA,CST-6, ,161367,C,103,LIX,0,0,Fire Department/Rescue,Heavy Rain, , ,2,E,2,E,MANDEVILLE,07/20/2021,907,30.3617,-90.0635,30.3611,-90.0619,"Vehicles are pushing flooding water into buildings on street including the fire station.","In the morning hours on July 20th, 2021, slow moving thunderstorms developed overnight ,one specific cluster formed over the Northshore that led to significant flooding, with areas of flooding elsewhere from developing clusters of thunderstorms through the morning hours. These storms formed within a rich Gulf, unstable airmass out ahead of an approaching outflow boundary and slow moving cold front from the west.",92
974997,ACADIA PAR.,EVANGELINE,07/20/2021,1050,Flash Flood, , ,0,0,0,0,LA,CST-6, ,161444,C,1,LCH,0,0,Law Enforcement,Heavy Rain, , ,4,N,5,N,EVANGELINE,07/20/2021,1150,30.32,-92.58,30.3421,-92.5725,"Posts from social media indicated numerous streets in and west of Iota flooded and impassable after several inches of rain.","Heavy rain in a slow moving thunderstorm produced flooding in Acadia Parish.",93
974468,EAST BATON ROUGE PAR.,NORTH BATON ROUGE,07/27/2021,1825,Flash Flood, , ,0,0,75000,0,LA,CST-6, ,161372,C,33,LIX,0,0,Fire Department/Rescue,Heavy Rain, , ,1,SE,1,SE,NORTH BATON ROUGE,07/27/2021,1825,30.51,-91.17,30.5045,-91.1676,"High water entered several vehicles near Arline Highway and Scenic Hwy. Water rescues  were conducted.","In the evening hours on July 27th, 2021, a disorganized cluster of showers and storms along a southward surging outflow boundary pushed heavy thunderstorms into portions of southern and southeastern Louisiana. Ample total atmospheric moisture content and instability led to intense rainfall rates ultimately causing areas of flash flooding.",94
974469,EAST BATON ROUGE PAR.,NORTH BATON ROUGE,07/27/2021,1830,Flash Flood, , ,0,0,0,0,LA,CST-6, ,161372,C,33,LIX,0,0,Public,Heavy Rain, , ,0,N,0,E,NORTH BATON ROUGE,07/27/2021,1830,30.52,-91.18,30.52,-91.1776,"Social media photos showed 1-2 ft of water at Scenic Highway and Harding Blvd.","In the evening hours on July 27th, 2021, a disorganized cluster of showers and storms along a southward surging outflow boundary pushed heavy thunderstorms into portions of southern and southeastern Louisiana. Ample total atmospheric moisture content and instability led to intense rainfall rates ultimately causing areas of flash flooding.",95
979296,CALCASIEU PAR.,WESTLAKE,08/15/2021,1812,Flash Flood, , ,0,0,0,0,LA,CST-6, ,162213,C,19,LCH,0,0,Emergency Manager,Heavy Rain, , ,3,S,3,NW,(LCH)LK CHARLES MUNI,08/15/2021,1912,30.1842,-93.2503,30.1656,-93.2514,"A quick 5 to 6 inches of rain produced street flooding in south Lake Charles near Barb High School. The emergency manager reported water began to enter his residence near the school.","A thunderstorm moved through Lake Charles causing flooding in south sections of the city.",96
967908,RICHLAND PAR.,RAYVILLE MUNI ARPT,08/19/2021,1612,Flash Flood, , ,0,0,1000,0,LA,CST-6, ,160142,C,83,JAN,0,0,911 Call Center,Heavy Rain, , ,1,SE,1,NNE,RAYVILLE MUNI ARPT,08/19/2021,1915,32.47,-91.76,32.4872,-91.7653,"Flash flooding occurred at the intersection of Julia and Fragala streets in Rayville.","Afternoon showers and thunderstorms developed within a tropical airmass. Some storms were slow moving and produced localized flash flooding.",97
978966,JEFFERSON PAR.,SOUTHPORT,08/29/2021,2200,Flash Flood, , ,0,0,0,0,LA,CST-6, ,162128,C,51,LIX,0,0,Emergency Manager,Heavy Rain / Tropical System, , ,1,SE,1,N,AVONDALE,08/30/2021,600,29.9623,-90.1603,29.9386,-90.1799,"Heavy rain fell throughout the parish causing significant street flooding. At least a few homes in Harahan suffered minor water intrusion from the flooding.","The ninth named storm, fourth hurricane, and second major hurricane of the 2021 Atlantic hurricane season, Ida originated from a tropical wave in the Caribbean Sea on August 23rd. On August 26th, the wave developed into a tropical depression, which organized further and became Tropical Storm Ida later that day, near Grand Cayman. On a northwestward track, Ida intensified into a hurricane on August 27, just before moving over western Cuba. A day later, the hurricane underwent rapid intensification over the Gulf of Mexico as it passed over a warm core eddy and reached major hurricane strength. It was just under 72 hours from tropical depression formation to category 4 strength with 150 mph winds. Ida remained at its peak intensity of 150 mph winds and a minimum central pressure of 929 millibars as it made landfall near Port Fourchon midday on August 29th. It didnt weaken to a tropical storm until it reached near the Louisiana/Mississippi border. ||Ida produced extensive to catastrophic damage across southeast Louisiana. On Grand Isle, around 40% of the structures were destroyed and the island was uninhabitable. Near 75% of the structures in Lafourche Parish were damaged or destroyed and likely similar numbers in Terrebonne Parish. 100+ mph wind gusts reached as far inland as Interstate 12. These winds damaged more than 30,000 poles, over 36,000 spans of wire and nearly 6,000 transformers. Of those more than 30,000 Louisiana poles, nearly 80% of those broken or damaged are from the most heavily impacted areas.|In total, the number of damaged or destroyed poles from Ida is more than hurricanes Katrina, Ike, Delta and Zeta combined. Due to major destruction to the power grid across the region, over 1 million customers were without power after landfall. Some of those power outages near the Louisiana coast lasted for around 4 weeks. |||The Louisiana Department of Health reported 3 direct fatalities and 28 indirect fatalities. Excessive heat and carbon monoxide poisoning were the most common causes of death. Indirect injuries associated with Ida: 351 heat-related, 183 carbon monoxide exposure, and 3 electrocutions. Storm surge ranged from a few feet to 10 to 15 feet. Hurricane Ida caused approximately $30 billion worth of damage.",98
979002,ST. CHARLES PAR.,MONTZ,08/29/2021,2200,Flash Flood, , ,0,0,0,0,LA,CST-6, ,162128,C,89,LIX,0,0,Emergency Manager,Heavy Rain / Tropical System, , ,0,N,0,NE,GYPSY,08/30/2021,600,30,-90.47,30.0253,-90.4647,"Heavy rain led to significant street flooding on the east bank of the parish, and several homes in the Norco and Montz areas took on water from heavy rainfall.","The ninth named storm, fourth hurricane, and second major hurricane of the 2021 Atlantic hurricane season, Ida originated from a tropical wave in the Caribbean Sea on August 23rd. On August 26th, the wave developed into a tropical depression, which organized further and became Tropical Storm Ida later that day, near Grand Cayman. On a northwestward track, Ida intensified into a hurricane on August 27, just before moving over western Cuba. A day later, the hurricane underwent rapid intensification over the Gulf of Mexico as it passed over a warm core eddy and reached major hurricane strength. It was just under 72 hours from tropical depression formation to category 4 strength with 150 mph winds. Ida remained at its peak intensity of 150 mph winds and a minimum central pressure of 929 millibars as it made landfall near Port Fourchon midday on August 29th. It didnt weaken to a tropical storm until it reached near the Louisiana/Mississippi border. ||Ida produced extensive to catastrophic damage across southeast Louisiana. On Grand Isle, around 40% of the structures were destroyed and the island was uninhabitable. Near 75% of the structures in Lafourche Parish were damaged or destroyed and likely similar numbers in Terrebonne Parish. 100+ mph wind gusts reached as far inland as Interstate 12. These winds damaged more than 30,000 poles, over 36,000 spans of wire and nearly 6,000 transformers. Of those more than 30,000 Louisiana poles, nearly 80% of those broken or damaged are from the most heavily impacted areas.|In total, the number of damaged or destroyed poles from Ida is more than hurricanes Katrina, Ike, Delta and Zeta combined. Due to major destruction to the power grid across the region, over 1 million customers were without power after landfall. Some of those power outages near the Louisiana coast lasted for around 4 weeks. |||The Louisiana Department of Health reported 3 direct fatalities and 28 indirect fatalities. Excessive heat and carbon monoxide poisoning were the most common causes of death. Indirect injuries associated with Ida: 351 heat-related, 183 carbon monoxide exposure, and 3 electrocutions. Storm surge ranged from a few feet to 10 to 15 feet. Hurricane Ida caused approximately $30 billion worth of damage.",99
978984,ORLEANS PAR.,MC DOLOGHVILLE,08/29/2021,2200,Flash Flood, , ,1,0,0,0,LA,CST-6, ,162128,C,71,LIX,0,0,Emergency Manager,Heavy Rain / Tropical System, , ,1,WNW,3,W,GENTILLY,08/30/2021,600,29.9398,-90.0672,30.0196,-90.0749,"Significant street flooding occurred in a few parts of the parish, though no homes were reported to take on water. One man drowned when he drove into a flooded underpass on I-10.","The ninth named storm, fourth hurricane, and second major hurricane of the 2021 Atlantic hurricane season, Ida originated from a tropical wave in the Caribbean Sea on August 23rd. On August 26th, the wave developed into a tropical depression, which organized further and became Tropical Storm Ida later that day, near Grand Cayman. On a northwestward track, Ida intensified into a hurricane on August 27, just before moving over western Cuba. A day later, the hurricane underwent rapid intensification over the Gulf of Mexico as it passed over a warm core eddy and reached major hurricane strength. It was just under 72 hours from tropical depression formation to category 4 strength with 150 mph winds. Ida remained at its peak intensity of 150 mph winds and a minimum central pressure of 929 millibars as it made landfall near Port Fourchon midday on August 29th. It didnt weaken to a tropical storm until it reached near the Louisiana/Mississippi border. ||Ida produced extensive to catastrophic damage across southeast Louisiana. On Grand Isle, around 40% of the structures were destroyed and the island was uninhabitable. Near 75% of the structures in Lafourche Parish were damaged or destroyed and likely similar numbers in Terrebonne Parish. 100+ mph wind gusts reached as far inland as Interstate 12. These winds damaged more than 30,000 poles, over 36,000 spans of wire and nearly 6,000 transformers. Of those more than 30,000 Louisiana poles, nearly 80% of those broken or damaged are from the most heavily impacted areas.|In total, the number of damaged or destroyed poles from Ida is more than hurricanes Katrina, Ike, Delta and Zeta combined. Due to major destruction to the power grid across the region, over 1 million customers were without power after landfall. Some of those power outages near the Louisiana coast lasted for around 4 weeks. |||The Louisiana Department of Health reported 3 direct fatalities and 28 indirect fatalities. Excessive heat and carbon monoxide poisoning were the most common causes of death. Indirect injuries associated with Ida: 351 heat-related, 183 carbon monoxide exposure, and 3 electrocutions. Storm surge ranged from a few feet to 10 to 15 feet. Hurricane Ida caused approximately $30 billion worth of damage.",100
986564,AVOYELLES PAR.,BELLEDEAU,09/06/2021,801,Flash Flood, , ,0,0,0,0,LA,CST-6, ,163399,C,9,LCH,0,0,Law Enforcement,Heavy Rain, , ,2,N,2,ESE,BELLEDEAU,09/06/2021,901,31.1078,-92.2052,31.0696,-92.1701,"Heavy rain produced flash flooding that temporarily closed Highway 114.","A cold front slow moved into the region sparking scattered thunderstorms. The very wet airmass in place allowed storms to produce high rain rates while slowly moving which produced flooding.",101
986570,CALCASIEU PAR.,GOSS,09/06/2021,850,Flash Flood, , ,0,0,75000,0,LA,CST-6, ,163399,C,19,LCH,0,0,Mesonet,Heavy Rain, , ,1,NNW,4,NNE,GILLIS,09/06/2021,1150,30.3153,-93.158,30.4322,-93.1798,"Stream gages and public reports indicated flooded streets and multiple flooded homes between Moss Bluff, Dequincy, and Gillis.","A cold front slow moved into the region sparking scattered thunderstorms. The very wet airmass in place allowed storms to produce high rain rates while slowly moving which produced flooding.",102
986772,ST. CHARLES PAR.,GYPSY,09/14/2021,1019,Flash Flood, , ,0,0,20000,0,LA,CST-6, ,163434,C,89,LIX,0,0,Public,Heavy Rain, , ,1,NE,0,E,GYPSY,09/14/2021,1019,30.03,-90.46,30.0199,-90.4664,"A member of the public reported stranded vehicles along Evangeline Road near Montz.","Tropical Storm Nicholas made landfall on the Texas coast south of Houston early Tuesday morning on September 14th. Over the next 24 hours, the weakening storm slowly tracked east-northeast along the coastline, reaching the LA/TX border Wednesday morning. During the 14th and 15th, outer bands of Nicholas expanded east across southeast Louisiana. The persistent rain from those banding features produced areas of flash flooding.",103
986773,ORLEANS PAR.,LEE,09/14/2021,1212,Flash Flood, , ,0,0,0,0,LA,CST-6, ,163434,C,71,LIX,0,0,Emergency Manager,Heavy Rain, , ,1,E,2,ESE,GENTILLY,09/14/2021,1312,30.02,-89.97,30.009,-90.0051,"NOHSEP reported multiple underpasses to be impassible due to high water.","Tropical Storm Nicholas made landfall on the Texas coast south of Houston early Tuesday morning on September 14th. Over the next 24 hours, the weakening storm slowly tracked east-northeast along the coastline, reaching the LA/TX border Wednesday morning. During the 14th and 15th, outer bands of Nicholas expanded east across southeast Louisiana. The persistent rain from those banding features produced areas of flash flooding.",104
986771,EAST BATON ROUGE PAR.,ESSEN,09/14/2021,1810,Flash Flood, , ,0,0,0,0,LA,CST-6, ,163434,C,33,LIX,0,0,Broadcast Media,Heavy Rain, , ,2,SW,0,WSW,ESSEN,09/14/2021,1810,30.38,-91.13,30.397,-91.1054,"Local media reported impassible roads around the Mall of Louisiana.","Tropical Storm Nicholas made landfall on the Texas coast south of Houston early Tuesday morning on September 14th. Over the next 24 hours, the weakening storm slowly tracked east-northeast along the coastline, reaching the LA/TX border Wednesday morning. During the 14th and 15th, outer bands of Nicholas expanded east across southeast Louisiana. The persistent rain from those banding features produced areas of flash flooding.",105
986774,ST. CHARLES PAR.,LULING,09/15/2021,156,Flash Flood, , ,0,0,500000,0,LA,CST-6, ,163434,C,89,LIX,0,0,Emergency Manager,Heavy Rain, , ,1,W,1,WSW,LULING,09/15/2021,156,29.93,-90.36,29.9229,-90.3638,"St. Charles emergency manager reported water in homes and numerous flooded roadways.","Tropical Storm Nicholas made landfall on the Texas coast south of Houston early Tuesday morning on September 14th. Over the next 24 hours, the weakening storm slowly tracked east-northeast along the coastline, reaching the LA/TX border Wednesday morning. During the 14th and 15th, outer bands of Nicholas expanded east across southeast Louisiana. The persistent rain from those banding features produced areas of flash flooding.",106
